tweet_id,tweet_time,tweet_text,location,retweets
1442634437452128257,2021-09-27 23:37:07,Moderna vs. Pfizer: Is There a “Best” mRNA Vaccine? | The Scientist Magazine® https://t.co/LLIjjlVfNF,"Holtville, CA",0
1442627337351307268,2021-09-27 23:08:54,@KeithAnliker I'm still waiting on the Moderna vaccine to get approval.,"Kokomo, IN",0
1442585769907003399,2021-09-27 20:23:44,"@Isabella_art6 For me it was no different than getting my flu shot. I got the Moderna vaccine so I had to get 2 shots. Had no side effects from it. People respond differently. You may have a sore arm, headache, or legs feel heavy, but you'll survive. Don't be afraid. Go get your shot. ❤","Indiana, USA",0
1442493258249248769,2021-09-27 14:16:07,Moderna to recall COVID-19 doses in Japan after stainless steel contaminants found https://t.co/lraRrYBn59,"Nashville, TN",0
1442470868706226181,2021-09-27 12:47:09,I got the Moderna vaccine. Can I get a Pfizer booster? https://t.co/Lis3ryz9DN via @nbcnews,"Baltimore, MD",1
1442445145258041344,2021-09-27 11:04:56,"@HettingClaus I’m not here to change anyone’s mind, but just like all the data &amp; marketing saying 5G is going take over WiFi I wanted to share this. I always like to read a lot of data from both sides. https://t.co/tmo6VrdV5G","Mentor, OH",0
1442323420834717703,2021-09-27 03:01:15,"By noon-ish tomorrow, I will have gotten both my flu vaccine and also my third Pfizer “booster” shot. I feel really excited about it (one shot in each arm). My wife can only get her flu shot, but soon will get her Moderna booster when it’s approved. Science does save lives.","Las Cruces, NM",0
