tweet_id	tweet_time	tweet_text	location
1441038748037222400	2021-09-23 13:56:25	@CaptinDeckerSTR Minimal side effects for me: arm was sore for a few days, and I was really fatigued for a bit, but that was it. I had the Moderna 2-shot vaccine .	Phoenix, AZ
1441012910902456321	2021-09-23 12:13:45	He took a 6 dose anthrax vaccine because of a minute chance of an bio attack. But draws the line at the COVID vaccine. Make it make sense. I won’t even get into the terrible side effects of the anthrax shot. https://t.co/lBwd64uJP8	McKinney, TX
1440921685943783424	2021-09-23 06:11:15	@DunkinThrees10 @brandonsblog @DataMiming @BleacherReport @BrianManzo20 @Rusty_SFChron No, its not how you take it. Medication is taken way more often than a vaccine period. Insulin is taken several times throughout day by injection. Vaccines are not taken that often so it will not have the same side effects as regular meds	Round Rock, TX
1440892078733643776	2021-09-23 04:13:36	@Sith_Lord42 @maybe19 @ryan_ramshaw @DarrenPlymouth Except nah. We're all are very well aware of vaccine side effects, like I said, and educate our patients as such. You're just big mad I'm right and, I might add, sound a bit off your rocker, sir.	Washington, DC
1440855952769511427	2021-09-23 01:50:03	@Crass_S @BallingerMom Absolutely fucking not. I got vaccinated, but no way in hell would I have Bryn take the covid vaccine. Im almost 40 whatever side effects this may have in the future I will deal with (I have lived a good life). Im not going to do it to her, when there are so many unknowns.	Knoxville, TN
1440837478529712129	2021-09-23 00:36:39	@jeffhaman73 @nathanmhansen @YouTube @kdaudt No, anyone can report anything to VAERS, you look for the results of examinations of the claims made to VAERS, just like the site tells you.Becoming the Hulk was a side effect reported to VAERS,for Christ's sake.Bad Data In  = Bad Data outhttps://t.co/FXt8c1TWQW	Jordan, MN
1440835079723372552	2021-09-23 00:27:07	@BFerguson11 @drninashapiro You Get To Live To See The Other Side Of A Global Pandemic. You People With Your #RedHats Do Not Understand Vaccine Testing. Because If You Can Basically Conduct Trials With 6 BILLION HUMANS. AND NOT HAVE ANY MAJOR ISSUES THAT MEANS LONGER TERM EFFECTS ARE NOT THERE. ✊🏽	Florida, USA
1440829625240674304	2021-09-23 00:05:26	About to take this Covid vaccine finally.   Been wrestling with this for a long time.  Even though we may not know what may happen in the future as far as side effects.    Nine hopefully..., I've seen to many people I know pass away the last few months. https://t.co/heSnilnG6E	Enterprise, AL
