tweet_id,tweet_time,tweet_text,location,retweets
1444341948760748033,2021-10-02 16:42:09,"Kramer from Seinfeld...now that's a pitch:Kramer tries to stop Jerry from taking the vaccine, using  Newman to send increasingly misleading info via USPS. George spirals after accidentally getting both Pfizer &amp; Moderna. Elaine's new boyfriend's great 'til he got the J&amp;J vaccine https://t.co/G6FpQdKXMi","Los Angeles, CA",0
1444318048580775936,2021-10-02 15:07:11,"FDA won't extend life of J&amp;J Covid vaccine doses, may extend Modernahttps://t.co/W7uxSkLoLY","Amityville, NY",0
1444307277968601089,2021-10-02 14:24:23,"Dr. Carrie Madej — examining Moderna and J&amp;J ""vaccine"" vials.  DISTURBING 🔥 https://t.co/u2y5jhMd13","Scottsdale, AZ",0
1444265643285618689,2021-10-02 11:38:57,"October will be a big month in vaccine rollout/discussion - FDA Vax Advisory Committee will discuss mix and match boosters, boosters for Moderna and J&amp;J, and EUA for 5-11s. https://t.co/o4ekrT8NxU","Maryville, TN",0
1444108430977994752,2021-10-02 01:14:14,🗓 VRBPAC has announced 3 upcoming meetings for vaccine discussions:- October 14: Moderna booster- October 15: J&amp;J booster- October 15: Mix-and-match boosters- October 26: Pfizer vaccine for kids 5-11  🎃💉❔🙏🏻https://t.co/wdnY0RQBfh,"Conway, AR",0
1444095460210262021,2021-10-02 00:22:42,"@tylerjschoon Just got back from Maui with my fiancé. It’s open, just make sure you fill out the information in Hawaii’s safe travels website. Upload your vaccine card, details of your trip, and fill out a survey and receive a QR code 24 hrs before your flight. Have fun!","Missouri, USA",0
1444052296057462786,2021-10-01 21:31:11,"In vaccine news: @US_FDA advisors plan to meet Oct 14 &amp; 15 on Moderna, J&amp;J boosters and Oct 26 on Pfizer vaccine for kids 5-11 years old!","Arlington, VA",0
1443933243905126401,2021-10-01 13:38:06,"The Durham Public Library HAS confirmation that the DHHS Mobile Equity COVID-19 Vaccine Van will be at the library TODAYFriday, October 1stfrom 10:00 am until 2:00 pm.Walk-ins are welcome.Open to the public ages 12+Pfizer, Moderna and J&amp;J vaccinations will be available https://t.co/zCz3vQeVdE","New Hampshire, USA",0
1443887335419138048,2021-10-01 10:35:41,"Lord, have mercy on her soul but stop this idiot! #aduitall50states NY Governor Forced to Take Emergency Measures as Her Vaccine Mandate Leads to Health Worker ShortagesREAD: https://t.co/xwKulnFHoI","Texas, USA",1
1443723736620883974,2021-09-30 23:45:36,"@Roper_Lab @covidtweets This is the flaw: the J&amp;J vaccine was designed with the mistaken belief that the spike protein was not a toxic antigen.  Once this assumption was refuted, it no longer fit that definition.","Manhattan, NY",0
1443651576686686212,2021-09-30 18:58:52,@DrVirgo1981 😂 Game on 😂 J&amp;J has a special place for traditionalists or people afraid of getting an mRNA vaccine. It’s a viral vector vaccine. They’ve been used forever.,"Framingham, MA",0
1443593657982984192,2021-09-30 15:08:43,@ENirenberg @IDWeek2021 No there is not. The J and J Rec for young patients w concerns about myocarditis was for adults above 18 yrs per panel. Hopefully the vaccine options widen as more research happens in the coming months and eligible age cohorts expand,"Chambersburg, PA",0
1443540443065634816,2021-09-30 11:37:15,"@nickantzoul @Choseusernam @J_Kartch @wizjb1 @TommyBeer It has happened before. The ""Spanish flu"" in 2018 2019 had similar public health restrictions and similar public response. Difference is we didn't develop a vaccine which..if people would understand..would accelerate our recovery from the pandemic","Pennsylvania, USA",0
1443519260995764227,2021-09-30 10:13:05,"Got the J&amp;J vaccine yesterday. Since yesterday evening, I have really achy all over. #VaccineMandate #johnsonandjohnson #thursdaymorning","Bryan, TX",0
1443452349113004034,2021-09-30 05:47:12,@thehill Vaccine r disgusting . Stop killing people with this dangerous vaccines especially j and j vaccine's,"Mill Valley, CA",0
1443373894598025218,2021-09-30 00:35:27,"This is not a surprise to those of us that have researched #covid19...13 different #organs get blood #clots people, of which the #brain is just one.Until everyone is #vaccinated there will be #variants!Your #mask with a #filter is your shield post vaccine.Too many idiots.j https://t.co/DHzOPlxJaU","Bardstown, KY",1
1443371451449581573,2021-09-30 00:25:45,Luka could try this and no one would bat an eye. Trey Burke gon be playing in that league with J.Cole if he dont get the vaccine https://t.co/cKyTKjI6Et,"Denton, TX",0
1443368173701632003,2021-09-30 00:12:43,@Kevmath Who’s enforcing this? Asking for a friend. Also any info for people coming to Vegas who wanna get the j and j vaccine in time for the main event?,"North Cape May, NJ",0
1443362384379326465,2021-09-29 23:49:43,@Macha96x He himself has the vaccine,"Bayamón, USA",0
1443359804777451529,2021-09-29 23:39:28,@jilevin I was one of the first children in #Cuba to receive the polio vaccine!Since then I have received the #smallpox #typhus #yellowfever #tetanus #pneumonia several #influeza and now #COVID19 J&amp;J vaccine. Looking forward to my booster shot when they aporove it,"Coral Gables, FL",0
1443357484652056579,2021-09-29 23:30:15,Absolutely no vet should be dishonorably  discharged for refusing a vaccine 💉! #TikTok https://t.co/zZWv5ISEgZ,"Alabama, USA",0
1443349293906104322,2021-09-29 22:57:42,Ohhh Kay them #russians are at it again lol smdh https://t.co/dLd741OZ0z,"San Francisco, CA",0
1443296168826609664,2021-09-29 19:26:36,"mRNA vaccine associated myocarditis more common in males, 12-29 y, more likely after second dose. Risk benefit assmnt needed before 2nd dose if the 1st dose caused myocarditis. Consider J&amp;J as alternative.  @IDWeek2021 #IDweek2021 https://t.co/MNP1pp2wMe","Chambersburg, PA",9
1443292500500701184,2021-09-29 19:12:01,@mumbles_j Shiiiiet Tell him to hmu if he wants to make 500k in commission and not have to worry about a vaccine.,"Poway, CA",0
1443287706692358147,2021-09-29 18:52:58,@ajclassic @Kept_It_Real55 @PUREBLOOD2020 @Chuckchewy1 @mumbles_j @bigbodybae If that's you or anyone else and you think the vaccine will help you or save you by all means get it!!! I'm just not,"Nashville, TN",0
1443270924363513857,2021-09-29 17:46:17,"@MarkLevineNYC @CarlinaRivera @NYCCouncil Slightly off topic, but SF is allowing people who received J&amp;J vaccine to get boosters - can NYC do the same, and if not, why not?","Brooklyn, NY",0
1443252184435544064,2021-09-29 16:31:49,"@DanHartness @Dyl4America @seattletimes Young people such as myself, who are healthy, fit, and have either had Covid are still have antibodies do not need the vaccine.Dylan would know this place, the owner of J&amp;J repair in moville spent a week in the hospital w/Covid. Really bad shape. He’s vaccinated…","Iowa, USA",0
1443249626992283660,2021-09-29 16:21:40,@mumbles_j He thought this was a smart move. smh. Whatever. I’d be right there applying as he ‘exercises his freedoms’ with my vaccine card in hand. #GetVaccinated,"Philadelphia, PA",0
1443221889615286273,2021-09-29 14:31:26,@Chuckchewy1 @Kept_It_Real55 @mumbles_j @bigbodybae You get the vaccine,"Nashville, TN",0
1443221401935171590,2021-09-29 14:29:30,@hey_rachelray @Kept_It_Real55 @mumbles_j @bigbodybae This rabbit hole we've jumped down has many twists and turns so I'll leave y'all with this... you get the vaccine,"Nashville, TN",0
1443127040689987586,2021-09-29 08:14:33,@LakotaMan1 Same here I did home healthcare for a couple of years then I got sick and had back to back 2 major surgeries 15 years ago I am an asthmatic and diabetic I jumped at the chance to get the 1 jab j&amp;j vaccine i have been covering my face and staying at home even before pandemic,"Chicago, IL",0
1443057309991669763,2021-09-29 03:37:28,"@dodo83747283738 Yes you are by claiming there are  vaccine related injuries going unreported, you are saying they are lyingYou claim your father had a stroke after J&amp;J vaccine...are you claiming your father is a woman under 50? J&amp;J has been transparent in their adverse reaction reporting","El Cajon, CA",0
1443027127037673473,2021-09-29 01:37:31,Very happy to learn that the NIH is conducting these studies as I’m hoping to get a mRNA booster to my J&amp;J vaccine. https://t.co/lkP4WTq4Dt,"Washington, USA",2
1443022408227622912,2021-09-29 01:18:46,@staugustine No way. I am test subject for the J &amp; J Vaccine and I already had two shots. The vaccine is safe and effective. It’s critical all are vaccinated. Vaccine Passports is the way to go for all.,"Jupiter, FL",0
1443014147889901568,2021-09-29 00:45:57,fact: my natural antibodies have outlasted both the J&amp;J and Moderna vaccine in two blood relatives.,"Mississippi, USA",0
1443006554492620810,2021-09-29 00:15:47,@SueCline Jealous of your booster! Waiting on that guidance for my J&amp;J vaccine 😷Hope your process is seamless and you feel okay afterward!,"Richmond, VA",0
1442967151300644876,2021-09-28 21:39:12,@StephanieSimon_ @erichhartmann @j_g_allen @washingtonpost Does everyone remember in the spring “Get the vaccine and get back to normal” and “If you’re vaccinated you don’t need to wear a mask”? Or has that been scrubbed from history like Stalin did in the USSR? #COVID19,"Paloma Creek, TX",0
1442943212209856513,2021-09-28 20:04:05,@i2Aaronn @BrandonHonaker1 Here’s the thing - it’s not LeBrons (or any athlete or celebs or politicians) responsibility to promote the vaccine. The data is there. People can make their own decisions and live with the consequences either way. This has to end.,"Virginia, USA",0
1442915004215279617,2021-09-28 18:11:59,#Covid19 J&amp;J vaccine trial update! I get a booster shot at the beginning of November!!!! YAY https://t.co/fvXXM1fcTI,"Raleigh, NC",0
1442905257500053504,2021-09-28 17:33:15,@BenevolentEms_ J&amp;J vaccine uses traditional virus based technology that’s been administered &amp; studied for decades,"Bronx, NY",0
1442886558969778179,2021-09-28 16:18:57,The Way They Forcing This Vaccine On People Is Making Me Give The Side Eye,"Washington, DC",0
1442819614925275137,2021-09-28 11:52:57,"@AnitaRo74232270 @m00nkittenz @Mark_J_ODonnell The vaccine does not use aborted fetuses. My goodness lady, get your facts right.","Pennsylvania, USA",0
1442697105752088579,2021-09-28 03:46:08,Okay if Dr. J comes out and says do not take the vaccine I will reconsider.   Pretty sure he got it. But these guys. No doctors here. Literally and figuratively. @KyrieIrving @RealDealBeal23 @22wiggins @JuliusErving @NBAonTNT @NBA,"Oklahoma, USA",0
1442689534462943235,2021-09-28 03:16:03,"I have worked in different jobs over the last year near those that had covid and some offices where some have died.  I got the weakest vaccine that was still accepted.. J&amp;J 1 shot (not 3) yet in the last month I’ve barely had a sniffle, and I don’t fear it.  I respect the choice","Florida, USA",0
1442669249529585669,2021-09-28 01:55:27,"@livinginthenow I got the Moderna vaccine (2nd in April). Happy with it,  no side effects. I've heard that the FDA/CDC will be considering a booster for both, Moderna and J&amp;J within the next two weeks. They recommend waiting and not jumping the gun or mixing vaccines.Best of luck.","Nicholasville, KY",0
1442650778901131265,2021-09-28 00:42:03,"@BluntStatement It doesn’t. Cases do not matter. The vaccine prevents hospitalization. The spread of the virus no longer matters. It’s never going to just vanish from earth. Living with it is our only option and the only number that matters is hospitalizations - and they’re trending down, again.","Virginia, USA",0
1442650054679011331,2021-09-28 00:39:10,@BluntStatement Negative. The very fact that data has shown that regardless of vaccination status the viral load is the same and those with or without the vaccine can catch and spread the virus at the same rate ended any thought of that premise. It’s now just a personal choice for protection,"Virginia, USA",0
1442647261322911748,2021-09-28 00:28:04,"@BluntStatement It’s not my, yours, the governments or anybody else’s problem if someone is overweight and the virus is worse for them. It’s up to that person to get themselves in better health - period. Masks/vaccine mandates/etc. none of that will matter if you’re in poor health.","Virginia, USA",0
1442522756038287365,2021-09-27 16:13:20,@KOLA95624349 @Shaine52441221 @thevirus1986 @J_Mei21 @TomiLahren @Meidas_Kiesha @AOC @YaOnlyLivvOnce @AlexaBliss_WWE @Paula_White @VP @IlhanMN @POTUS @IsraeliPM @jack @JoelOsteen @Pontifex @NorthKoreaDPRK @RealCandaceO @heathergtv @KayaJones @SpeakerPelosi @VinceMcMahon @IvankaTrump @BardiUpdatess @RonDeSantisFL @SenTedCruz @RonJohnsonWI @HARRISFAULKNER @EmilyCompagno @kayleighmcenany @JessicaTarlov @LeaderMcConnell @SashaBanksWWE @FoxNews @CNN @SenSchumer @BMeiselas @GavinNewsom @benshapiro @CarleyShimkus @JudgeJeanine @mtgreenee @ainsleyearhardt @SandraSmithFox @FLOTUS @ScottWalker @tedcruz @GovRonDeSantis @JoyVBehar Do you know what's in the vaccine n booster  Joe if you do n don't tell us your in sin of murder in God's eyes are you a murderer  Joe Jill n VP?All 3 of your actions show you know so ya a murderer I'd tell my people if I knew allergic 🤧 reaction isn't something to play with,"Winchester, KY",0
1442521579250929671,2021-09-27 16:08:39,@KOLA95624349 @Shaine52441221 @thevirus1986 @J_Mei21 @TomiLahren @Meidas_Kiesha @AOC @YaOnlyLivvOnce @AlexaBliss_WWE @Paula_White @VP @IlhanMN @POTUS @IsraeliPM @jack @JoelOsteen @Pontifex @NorthKoreaDPRK @RealCandaceO @heathergtv @KayaJones @SpeakerPelosi @VinceMcMahon @IvankaTrump @BardiUpdatess @RonDeSantisFL @SenTedCruz @RonJohnsonWI @HARRISFAULKNER @EmilyCompagno @kayleighmcenany @JessicaTarlov @LeaderMcConnell @SashaBanksWWE @FoxNews @CNN @SenSchumer @BMeiselas @GavinNewsom @benshapiro @CarleyShimkus @JudgeJeanine @mtgreenee @ainsleyearhardt @SandraSmithFox @FLOTUS @ScottWalker @tedcruz @GovRonDeSantis @JoyVBehar There's chemicals in vaccines that some are ilergic to for if it goes in them it's murder so there ya have it children they want you to put unknown things in your body you might be allergic to for that's a death sentence to  you as whom knows what's in the vaccine or booster,"Winchester, KY",0
1442503141681872900,2021-09-27 14:55:24,@CenterStageDS @Kody_Kox I agree. I’ve got several friends here at home who have had small to severe reactions to the vaccine. I took the J/J one and just got a bad fever for a day and then I was fine but there are others who have had it far worse. Forcing or mandating this just isn’t right IMO.,"North Carolina, USA",0
1442490625283268609,2021-09-27 14:05:39,"@HirokoTabuchi J&amp;J guy here now at JFK heading to Japan. I’ll stomach the 14d quarantine but concerned more about the supposed vaccine passport rolling out in Nov, wondering if Yoshinoya won’t approve my J&amp;J stamp…","Queens, NY",0
1442289907247063040,2021-09-27 00:48:04,Karen must’ve had the J&amp;J vaccine! Those side effects ain’t no joke 🥴😂😂😂 #RHOP,"Harrison, TN",0
1442275069007319040,2021-09-26 23:49:07,@j_g_allen A friend just sent me an article about a tennis player who says he's out for the season and blames the vaccine side effects! Weak sauce doesn't even begin to cover it...https://t.co/aB0sRVqPnd,"Camarillo, CA",0
1442102925116035072,2021-09-26 12:25:04,@collinwood_j So the vaccine doesn’t work. Thank you. I can’t believe I wasted my time getting it.,"Southgate, MI",0
1441921144416870402,2021-09-26 00:22:45,"@one_kelevra @RepTomRice I don’t expect everyone to take the vaccines. I do expect that if people haven’t had the virus or the vaccine they will take the needed precautions to protect those who haven’t or can’t. My mother in her 70’s had to wait for the J&amp;J, because she is allergic to a substance…","Virginia Beach, VA",0
1441904593315647490,2021-09-25 23:16:58,We have a vaccine glut in the US and I can literally double dip and be quadruple jabbed with both Pfizer and Moderna no questions asked...or go for the trifecta when J&amp;J becomes available again...why did our president wait so long to share? #GlobalCitizenLive https://t.co/yWL1vjDTIy,"Dallas, TX",0
1441829134745882653,2021-09-25 18:17:08,@SPA_2 @jessicanolanbow @NBCNews pfizer is the only vaccine with full approval. I know you remember the astra zenaca situation and europe or the low efficacy rates in the J&amp;J vaccine. not to combat you but these situations play into the non-vax world.,"Paterson, NJ",0
1441619946828619777,2021-09-25 04:25:53,"@_Bill_ @glassmeg @MacFarlaneNews Just ran into this first hand report on tiktok: this prison rewarded (bribed) inmates with bags of coffee if they accepted the vaccine, &amp; gave them J&amp;J so they wouldn't have to keep track of second dose.https://t.co/nGBrzyIRVJ","Appleton, WI",0
1441610257822851073,2021-09-25 03:47:23,@KOLA95624349 @Shaine52441221 @thevirus1986 @J_Mei21 @TomiLahren @Meidas_Kiesha @AOC @YaOnlyLivvOnce @AlexaBliss_WWE @Paula_White @VP @IlhanMN @POTUS @IsraeliPM @jack @JoelOsteen @Pontifex @NorthKoreaDPRK @RealCandaceO @heathergtv @KayaJones @SpeakerPelosi @VinceMcMahon @IvankaTrump @BardiUpdatess @RonDeSantisFL @SenTedCruz @RonJohnsonWI @HARRISFAULKNER @EmilyCompagno @kayleighmcenany @JessicaTarlov @LeaderMcConnell @SashaBanksWWE @FoxNews @CNN @SenSchumer @BMeiselas @GavinNewsom @benshapiro @CarleyShimkus @JudgeJeanine @mtgreenee @ainsleyearhardt @SandraSmithFox @FLOTUS @ScottWalker @tedcruz @GovRonDeSantis @JoyVBehar Ya can't beat I word of God's act now choice is yours vaccine drug dealing pushers will ya give they children their freedoms back of privacy in  medical as it's law or fall as Trump is?,"Winchester, KY",0
1441609772814553088,2021-09-25 03:45:28,@KOLA95624349 @Shaine52441221 @thevirus1986 @J_Mei21 @TomiLahren @Meidas_Kiesha @AOC @YaOnlyLivvOnce @AlexaBliss_WWE @Paula_White @VP @IlhanMN @POTUS @IsraeliPM @jack @JoelOsteen @Pontifex @NorthKoreaDPRK @RealCandaceO @heathergtv @KayaJones @SpeakerPelosi @VinceMcMahon @IvankaTrump @BardiUpdatess @RonDeSantisFL @SenTedCruz @RonJohnsonWI @HARRISFAULKNER @EmilyCompagno @kayleighmcenany @JessicaTarlov @LeaderMcConnell @SashaBanksWWE @FoxNews @CNN @SenSchumer @BMeiselas @GavinNewsom @benshapiro @CarleyShimkus @JudgeJeanine @mtgreenee @ainsleyearhardt @SandraSmithFox @FLOTUS @ScottWalker @tedcruz @GovRonDeSantis @JoyVBehar Ya can't say choice ya don't know what it means vaccine drug pusher of no proof ya days are over as u Joe n your administration steals a choice of freedoms of all constitution laws even gun laws I tried to make you see but ya ran ashtray like Donald j Trump for choice is yours https://t.co/aEOMkwUdw5,"Winchester, KY",0
1441509438683328513,2021-09-24 21:06:46,"The booster drive through site will be open Monday–Friday from 10 am – 6 pm. Bring proof of vaccination, preferably your vaccine card that lists your previous vaccinations. Only Pfizer boosters will be available. Moderna and J&amp;J boosters are not recommended at this time.","Asheville, NC",0
1441497016283004935,2021-09-24 20:17:25,"@stevecripe57 @FTWTX1 @WHCOVIDResponse @texasdemocrats Doctor on CNN today said that doctors can give Pfizer vaccine (off label) to others, such as those who got Modern or J&amp;J.","Ukiah, CA",0
1441466720867086338,2021-09-24 18:17:02,@KOLA95624349 @Shaine52441221 @thevirus1986 @J_Mei21 @TomiLahren @Meidas_Kiesha @AOC @YaOnlyLivvOnce @AlexaBliss_WWE @Paula_White @VP @IlhanMN @POTUS @IsraeliPM @jack @JoelOsteen @Pontifex @NorthKoreaDPRK @RealCandaceO @heathergtv @KayaJones @SpeakerPelosi @VinceMcMahon @IvankaTrump @BardiUpdatess @RonDeSantisFL @SenTedCruz @RonJohnsonWI @HARRISFAULKNER @EmilyCompagno @kayleighmcenany @JessicaTarlov @LeaderMcConnell @SashaBanksWWE @FoxNews @CNN @SenSchumer @BMeiselas @GavinNewsom @benshapiro @CarleyShimkus @JudgeJeanine @mtgreenee @ainsleyearhardt @SandraSmithFox @FLOTUS @ScottWalker @tedcruz @GovRonDeSantis @JoyVBehar All whom push the vaccine apon others freedom of religion of science doctors n government are of law suits material it's also invasion of privacy n now discrimination my favorite so fix ya sinful ways yall fastly https://t.co/r1VwrCUmpY,"Winchester, KY",0
1441433911855173632,2021-09-24 16:06:39,@newsmax The VACCINE causes lots of damage! I was healthy before the jab which was mandated by my employer. I took the J&amp;J and have been sick ever since. It’s been 5 weeks!,"Colorado, USA",5
1441390637987753994,2021-09-24 13:14:42,"Fascinating example of presidential administration, with a disagreement between the agency head and the agency's advisory committee, scientific opinions, and policy judgments. https://t.co/DNJBWajvAo","Florida, USA",5
1441259403823312905,2021-09-24 04:33:13,@zeynep @EricTopol I’m disappointed of the lack of information. I regret getting the J&amp;J vaccine now.,"Portland, OR",1
1441213584994865152,2021-09-24 01:31:09,@sarahkhan556 Zero problems with the J &amp; J vaccine for me.,"Villa Park, IL",0
1441213268379385858,2021-09-24 01:29:54,Why is the fed gov spending $2100 for monoclonal antibody treatments for people who refuse a $210 vaccine? J&amp;J vaccines based on 300 year old techn-Modurna &amp; Pfizer based on 30 year old tech.Monoclonal antibodies are less than a year old and are completely experimental!,"Grand Rapids, MI",0
1441212560372498435,2021-09-24 01:27:05,"What are the odds that someone who had J&amp;J and then an mRNA booster would get seriously ill from the vaccine, compared to their odds of having nasty outcomes from catching COVID after being refused a booster for their less-effective vaccine?","Boston, MA",1
1441211855066722312,2021-09-24 01:24:17,The thing that the public health authorities owe us on mixing and matching is a clear explanation of why they don't believe mixing J&amp;J with mRNA vaccines is safe when it's being done in France and studies have been done conclusively with the very similar AZ vaccine. https://t.co/WWy24iomg2,"Boston, MA",7
1441208788183240713,2021-09-24 01:12:06,"@j_lafo_ @EugeneDaniels2 Yes, the mu and lambda variants have shown resistance but the fact y’all are alive to tell your story shows the vaccine is still working 🙏🏾","Charlotte, NC",0
1441189882433458181,2021-09-23 23:56:58,"In Hawaii, you cannot enter any business without a vaccine card or negative covid test within the last 24 hours. Masks are required at all times outside your home - to include the beach. https://t.co/N7p4cOursi","Virginia, USA",0
1441164581175545863,2021-09-23 22:16:26,"@GovRonDeSantis Maybe if you would work with him instead of against him he maybe more apt to work with you,you are refusing mask mandates,you refuse to properly inform the public that the vaccine is safe,hell phyzer has been fda approved,I remember in January how you did push the J&amp;J.","Orlando, FL",0
1441151041790091270,2021-09-23 21:22:38,@KOLA95624349 @Shaine52441221 @thevirus1986 @J_Mei21 @TomiLahren @Meidas_Kiesha @AOC @YaOnlyLivvOnce @AlexaBliss_WWE @Paula_White @VP @IlhanMN @POTUS @IsraeliPM @jack @JoelOsteen @Pontifex @NorthKoreaDPRK @RealCandaceO @heathergtv @KayaJones @SpeakerPelosi @VinceMcMahon @IvankaTrump @BardiUpdatess @RonDeSantisFL @SenTedCruz @RonJohnsonWI @HARRISFAULKNER @EmilyCompagno @kayleighmcenany @JessicaTarlov @LeaderMcConnell @SashaBanksWWE @FoxNews @CNN @SenSchumer @BMeiselas @GavinNewsom @benshapiro @CarleyShimkus @JudgeJeanine @mtgreenee @ainsleyearhardt @SandraSmithFox @FLOTUS @ScottWalker @tedcruz @GovRonDeSantis @GovAndyBeshear For all this pushing yall do it's time those whom make this vaccine be held responsible and law suits shall start as it doesn't proof safety nor healing or helping one what does happen is sickness n  death may take you from your loved ones for all whom push it is responsible https://t.co/UMeMy0l4wL,"Winchester, KY",0
1441143532320792578,2021-09-23 20:52:47,"@J_s_9229 @Imaimeemiami @Nashtfs @JennyErikson The vaccine makes it less likely for you to get the virus (among other things). So even if you DO get the virus, a vaccinated person is less likely to catch it from you then an unvaccinated person. It lessens the spread.","Eugene, OR",0
1441128985128099853,2021-09-23 19:54:59,@KOLA95624349 @Shaine52441221 @thevirus1986 @J_Mei21 @TomiLahren @Meidas_Kiesha @AOC @YaOnlyLivvOnce @AlexaBliss_WWE @Paula_White @VP @IlhanMN @POTUS @IsraeliPM @jack @JoelOsteen @Pontifex @NorthKoreaDPRK @RealCandaceO @heathergtv @KayaJones @SpeakerPelosi @VinceMcMahon @IvankaTrump @BardiUpdatess @RonDeSantisFL @SenTedCruz @RonJohnsonWI @HARRISFAULKNER @EmilyCompagno @kayleighmcenany @JessicaTarlov @LeaderMcConnell @SashaBanksWWE @FoxNews @CNN @SenSchumer @BMeiselas @GavinNewsom @benshapiro @CarleyShimkus @JudgeJeanine @mtgreenee @ainsleyearhardt @SandraSmithFox @FLOTUS @ScottWalker @tedcruz @GovRonDeSantis @GovAndyBeshear Ya vaccine is weak n a lye to control God's children n make they blood unclean https://t.co/2FAZqsm4Uq,"Winchester, KY",0
1441128721767747584,2021-09-23 19:53:56,"@UtahDepOfHealth I have the J&amp;J vaccine in March. Had a little cough next day bad cough, 4days hurting cough, better but not recovered.Yes I tested positive.@POTUS&amp; @GovCox @LGHendersonUtah Our state &amp; federal government has has failed to produce millions of free K95 masks. WHY https://t.co/92Px8G1Z4c","Millcreek, UT",1
1441127881690677251,2021-09-23 19:50:36,"@trenthead I have the J&amp;J vaccine in March. Had a little cough next day bad cough, 4days hurting cough, better but not recovered.Yes I tested positive.@POTUS&amp; @GovCox @LGHendersonUtah @UtahDepOfHealth Our state &amp; federal government has has failed to produce millions of free K95 masks. WHY https://t.co/Rih2hkPuh2","Millcreek, UT",1
