tweet_id,tweet_time,tweet_text,location,retweets
1444413499917180942,2021-10-02 21:26:28,@funny_layde @jvbt82hhs You are MORE apt to have side effects if you have had Covid. Still get the vaccine.,"Ohio, USA",0
1444407912885993476,2021-10-02 21:04:16,"@JoshuaEtheredg1 @TeslaYinTexas @ryanmdelaney @BrianMFloyd Look, there is always a very tiny % of people that have side effects from vaccine (or any medication, food, consumable, etc for that matter). It is impossible to deconvolute the fact that people have only recently learned of VAERS from the uptick in reports and uptick in jabs.","Santa Barbara, CA",0
1444365825423642624,2021-10-02 18:17:02,"https://t.co/nfze7fGRWp The side effects (if you do have any, because I know of some people who only had mild to no symptoms at all, including myself) is a very small price to pay for (added) protection against #COVID19 and from infecting others. #GetVaccinated","New York, USA",0
1444324731625226241,2021-10-02 15:33:44,@NBCNews Yes but who needs those side effects the vaccine causes and possibly death.What about the people that died from be supposed underlying causes after getting vaccinated?,"Stockton, CA",0
1444307713391927300,2021-10-02 14:26:07,@Willard57475229 @Geraldi62138003 @Reuters Oh sorry it's $25 https://t.co/jLgDFDCzn4Still much cheaper than the average $38k hospital stay due to covid where they treat people with way more EUA drugs with documented side effects worse than the vaccine.,"Los Angeles, CA",0
1444245582973968384,2021-10-02 10:19:14,Every other vaccine in my blood stream has successfully completed phase 3 trials for long term side effects. Guess what vaccine is still in phase 3? 😂😂 but gone head lab rats lmfaoo https://t.co/naVmxVw6oO,"Missouri City, TX",0
1444220282089062401,2021-10-02 08:38:42,"Had no choice but to get vaxxed bc of work and travel 🤦🏻‍♀️ but eff this vaccine. 2nd dose and I’m sick, again. With ALL the damn side effects. Covid you’re ass and so is your vaccine.","East Palo Alto, CA",0
1444203908176306177,2021-10-02 07:33:38,@TiberiusSpeaks @unheardparent Well we're not getting the truth anyway about the vaccine. They don't want to let us know that the numbers are higher than they really are about problems and side effects of the vaccine,"Umatilla, OR",0
1444199057874898944,2021-10-02 07:14:21,Shot #2 in the arm. Now to just get thru the side effects.   My immune system is fighting.  #COVID19 #vaccine https://t.co/X5N4xLo4sw,"Florida, USA",0
1444185868114276353,2021-10-02 06:21:57,@cbfromdcc My father has something surgical to keep his heart from stopping. My mother an father both took the vaccine. My mom was sick for a day. My dad no side effects. I took the vaccine for them. I have no side effects. It’s your choice. I’ve had close friends an family pass. Up to you,"Toledo, OH",0
1444158606853775362,2021-10-02 04:33:37,(If you have been denied the educational content to know what this means: it’s not vaccine side effects. Those are both pregnancy symptoms.),"Columbus, OH",0
1444110433456173061,2021-10-02 01:22:12,"@mountainfoxsun @MonicaGandhi9 Yes, a very small percentage of recipients of the vaccine experience negative side effects including myocarditis.No one is claiming otherwise.","Alabama, USA",0
1444096824760020996,2021-10-02 00:28:07,"@WandrMe Many pilots are concerned about about possible side effects of a vaccine on their medical status down the road. I'm not saying I agree with this, or hold these beliefs as I'm vaxed. Just what I've been hearing / seeing.","Elk Grove Village, IL",0
1444082847724105729,2021-10-01 23:32:35,@ernunnos @IanFelipeSays @ScottAdamsSays @GRCBama Different variables. We know much more about long term vaccine risk than we do long Covid. Also many more side effects and complications from Covid than from vaccines.,"Los Angeles, CA",0
1444075660796891137,2021-10-01 23:04:01,Thank you Draymond green.. everybody wanna talk about what happened to their family member with covid but nobody wants to talk to the family members who got the shot and died or life has been altered from the side effects from the vaccine.. that’s what gets lost https://t.co/p6naEAxCKb,"North Carolina, USA",0
1444062857163853824,2021-10-01 22:13:09,When children 5-11 do get a EUA for vaccines remember this article and how a leading vaccine expert delayed their child's second dose by a few weeks. Data has shown it leads to longer lasting immunity and decreased risk of already low side effects https://t.co/FH22Q7kowX,"Fairmount, NY",0
1444057294312984576,2021-10-01 21:51:02,These side effects from then Covid Vaccine Shot are no joke. It has kicked my butt both times. Vaccine-2 Jeff-0,"Waterford, MI",0
1444047756767674376,2021-10-01 21:13:08,#DODMandate #COVID19#vaccinationNow I wonder how they'll punish her for disagreeing with the dog faced pony soldiers who created this half-assed mess.https://t.co/ukaKMsUSPg,"Cookeville, TN",1
1443979743653765171,2021-10-01 16:42:53,"If this was only affecting you, and you personally, then I would disagree but that’s your choice. People always respond with “oh the death rate is super low”, “getting vaccinated has its own side effects”, or “the vaccine doesn’t prevent you from getting it”.","Minneapolis, MN",0
1443955862368886784,2021-10-01 15:07:59,"I was then was released due to Codvid-19 vaccine side effects, all I'm asking is for someone to help out trying to put my life together by Retweeting my gofund me page and any donations would help. I've tried contacting most agencies with failure.","New Orleans, LA",0
1443948549922820096,2021-10-01 14:38:56,"@TheosTina @WSJ I'd much rather get a free vaccine that's been given to hundreds of millions without side effects , look what thalidomide did &amp; it's not the HPV vaccine that kills you but chemo sure does","Brooklyn, NY",0
1443935866456526853,2021-10-01 13:48:32,"@AkaiLee28 @karenhunter @AfricanaCarr @SXMUrbanView True so my question to you is we've seen recent drugs have adverse effects over time and I understand this isn't a drug, but with continued booster recommendations it may gravitate towards drug status instead of vaccine, and I'm just asking what are the side effects over time?","Arlington, TX",0
1443930948979105792,2021-10-01 13:28:59,"Also I was fired for getting my Codvid-19 vaccine to work one day a week, the side effects is what got me fired! no money and suffer from  health issues and . bills adding up. All help is appreciate and I cannot even keep up have a sinking apartment, black mold ect.","New Orleans, LA",0
1443925054073544748,2021-10-01 13:05:34,"Also I was fired for getting my Codvid-19 vaccine to work one day a week, the side effects is what got me fired! no money and suffer from  health issues and . bills adding up. All help is appreciate and I cannot even keep up have a sinking apartment, black mold ect. I have no","New Orleans, LA",0
1443921540094042148,2021-10-01 12:51:36,@AkaiLee28 @karenhunter @AfricanaCarr @SXMUrbanView Which is it? We can trust there are no long term side effects based on previous vaccines not having any? Or we can trust the quick development because this is a new vaccine based on a new technology? You can't have it both ways and not expect people to ask questions.,"Arlington, TX",0
1443919716062535703,2021-10-01 12:44:21,"Also I was fired for getting my vaccine to work one day a week, the side effects is what got me from codvid-19 fired! I have no money resources nothing if you could Retweet. Even $1.00 helps.","New Orleans, LA",0
1443916472242352128,2021-10-01 12:31:28,"Also I was fired for getting my due to side affects of the vaccine to work one day a week, the side effects is what got me fired me releated but anyone out there could help be great. Retweet my gofund me page would help. Even $1.00 would help.","New Orleans, LA",0
1443916229241098241,2021-10-01 12:30:30,"@marclamonthill Glad you are recovering. For the sake of good information about a vaccine that has only been in use for a year, and has caused some adverse side effects including blood clots: what Vac  did you get, and when did you get it?","Deptford, NJ",0
1443903619569496066,2021-10-01 11:40:23,"@FlexiTechSoft @RenaDestin @TeresaH83217036 If you believe the vaccine makes you immune to Covid, think again. It doesn’t. All kinds of vaccinated people come down with Covid after receiving the vaccine. Go to VAERS website &amp; look at all the serious side effects of the vaccine too. Up to &amp; including death.","Winchester, KY",0
1443790125641527298,2021-10-01 04:09:24,"@wellboy 1. Not concerned about     contracting it2. Have a history of vaccine     sensitivity3. Don't trust it, as was      rushed, questionable? 4. So many reports of side     effects, incl. death 5. Have a strong immune     system6. Doesn't appear to be      very effective","Zillah, WA",0
1443760706705317890,2021-10-01 02:12:30,Please tell what vaccine side effects you saw/heard working with Covid??? https://t.co/fEpLErKTXV,"Miami, FL",2
1443737417408606232,2021-10-01 00:39:58,Joe Rogan continues to spread vaccine misinformation. Now suggests President Biden faked getting booster shot on TV: “What if he dies? What if he blacks out? What if he gets it &amp; faints? People have had very bad reactions.” Serious side effects to the vaccine are extremely rare. https://t.co/5nETsoEr2G,"Los Angeles, CA",20
1443736965887807494,2021-10-01 00:38:10,"@Teddifish @TeacherManSam @JoyAnnReid I have had covid twice... it was nothing, not saying it isn't for other people just stating facts about me... the odds are overwhelmingly in my favor without the vaccine, so why risk contracting the terrible side effects the vaccine has when covid is not detrimental?","Jefferson City, MO",0
1443731641155870725,2021-10-01 00:17:01,"Imagine being in the NFL, running full speed into other people, slamming your head into other people's heads, brain looking like mashed potatoes, and then being like, ""I'm concerned about vaccine side effects.""","St Louis, MO",2
1443707004120301568,2021-09-30 22:39:07,"@RealUCBfosho @thehill Anthrax vaccine isn’t 100% safe either, but is still required &amp; troops can’t deploy without it. Many veterans had long-term negative side effects from the multi-dose Anthrax vaccine. But the alternative is being exposed without protection &amp; that’s not how the military operates.","Seattle, WA",0
1443671907887423489,2021-09-30 20:19:39,Not these ladies talking about all the side effects from the vaccine they was experiencing in the hair salon.. bitches stfu I’m trynna woosah while I get this hair done,"North Carolina, USA",0
1443651280950333460,2021-09-30 18:57:41,"I deadass saw a tweet saying “my body hurts the day after the covid vaccine” like as in a way to not get it , when literally one of the mail side effects is the day after you get it being in pain 😭😭 I can’t","Los Angeles, CA",0
1443638121749352460,2021-09-30 18:05:24,"@HeyokaEmpath01 Same with my friend who went thru chemo, got Covid and still refuses to get the vaccine because you know, side effects. 🤷‍♀️","Napa, CA",1
1443605261478883334,2021-09-30 15:54:49,"@Teddifish @JoyAnnReid But the vaccine doesn't do that... so you aren't really following science... according to VAERS people who would have most likely been just fine with the very survivable covid ended up with terrible side effects, including death from a vaccine that doesn't actually do much","Missouri, USA",0
1443602088458522624,2021-09-30 15:42:13,@PirrohasFans They probably have seen the side effects of the vaccine that is not being shared with the rest of us.,"Minneapolis, MN",0
1443595999629479939,2021-09-30 15:18:01,Because it was a wave of the vaccinated Sheeple! If they told the truth about Florida they would have to admit that their eugenics vaccine has side effects! https://t.co/NjbwZdVJ1x,"Lehigh Acres, FL",0
1443551720592842756,2021-09-30 12:22:04,"@LisannaBoo Or the vaccine causing terrible side effects. That's what the real ""break through "" cases are","Illinois, USA",0
1443523324265517057,2021-09-30 10:29:14,A coherent answer on those who chose natural immunity and innate biological mechanisms over a vaccine  with side effects and no true immunity. #COVID19 #GeneTherapy 🧬 #FreedomofChoice https://t.co/ttrl3d1Wjj,"Camden, NJ",0
1443520275375591426,2021-09-30 10:17:07,"@infinitusestnum @FoxNews You do realize that you can get Covid with the vaccine, right? You do know that you have a higher transmission rate as vaccinated, right? You do know that people have had serious side effects including blood clotting and death, right? 🐑","Wisconsin, USA",0
1443511359442984963,2021-09-30 09:41:41,Ok so people will refuse mandatory vaccines and go to take antibody treatment which has side effects like the vaccine and is man made as well... 1 or the other and we can get thru this pandemic but choose 1 or the other.,"Tennessee, USA",0
1443478739535294464,2021-09-30 07:32:04,@JerasIkehorn Got the flu vaccine 5 days after.I'm a low to no side effects person so it was ok to get the flu shot.That is the concern on getting both. Its the combo of side effects not the effectiveness.,"Oxnard, CA",0
1443459367236476930,2021-09-30 06:15:05,"@trebor219 @mschlapp I had covid and while symptomatic I survived just fine. Yes, the vaccine side effects are present. If the Vax worked against trolls then your tweet wouldn't be here.","Louisiana, USA",0
1443369165520183296,2021-09-30 00:16:40,Why are the media ignoring Covid-19 vaccine related deaths and side effects? Seems disingenuous.,"Mesa, AZ",1
1443363135440801792,2021-09-29 23:52:42,woke up to some super delayed side effects from the covid vaccine /:,"Houston, TX",0
1443347009490935813,2021-09-29 22:48:37,"@Briannasulliva9 His natural immunity last for like 3 months, maybe 6. At which time he’s left with nothing. And the side effects of the vaccine factually to this point aren’t close to the side effects of catching Covid again. It’s an opinion not based in fact (contd)","San Diego, CA",0
1443331925373067271,2021-09-29 21:48:41,"@CeeHawk a few hundred people out of 185 million vaccinated Americans had minor side effects from this vaccine better just risk my chances with the disease that's killed almost 700,000 people in America alone.","Peabody, MA",0
1443329263214735361,2021-09-29 21:38:06,"@amandamull It made my arm hurt a little for a couple of days. Other than that, I’ve never had vaccine side effects in my life. I never knew it was a thing until Covid.","Cleveland Heights, OH",0
1443317233531371524,2021-09-29 20:50:18,@DailyNative1 I just had my 3rd Pfizer vaccine and guess what? No side effects whatsoever! Don’t be a #COVIDIOT #GetVaccinatedNow #NativesArePatriotsTheyVote#NativesGetVaccinated,"Dallas, TX",0
1443308323835678726,2021-09-29 20:14:54,"@JerseyFinFan @JamesBurnett11 And yes, you are 100% right, dying from Covid is rare, but whats even more rare is getting severe side effects from the vaccine. Look man, I sympathize with you and your wife, I have no idea what you're going through, and if I was in your situation I may feel the same.","Thomaston, NY",0
1443282970647810049,2021-09-29 18:34:09,"@JoshuaEtheredg1 @TeslaYinTexas @ryanmdelaney @BrianMFloyd An uptick in # does not concern me, no, because there has been a massive uptick in jabs. They use the entire batch of VAERS data to identify possible vaccine side effects that were initially undetected: only those that are statistically significant merit concern.","Santa Barbara, CA",0
1443268489788153863,2021-09-29 17:36:37,"Joined @edokeefe @CBSNews to discuss:- NY Vaccine Mandates - if you are a healthcare worker, you took an oath... get the 💉Pfizer 💉 for 5-11 - Likely recommendation in 4-5 wksExpect similar side effects to after your 2nd shot with booster#GetVaccinated https://t.co/m6ExPKO9Hn","Houston, TX",2
1443263013339889664,2021-09-29 17:14:51,"@rifkalove13 @ewarren Side Effects?EVERY vaccine you've ever had in your life has side and adverse effects in a small portion of the population. So do OTC medications...Foods...Drinks...Household cleaners...Insects bites...And about 1,000,001 other things.🙄🤦‍♀️🙃","Stanford, CA",0
1443228610966528005,2021-09-29 14:58:09,I got my Covid Booster yesterday in one arm and the flu vaccine in the other.  I have had NO side effects from either! https://t.co/KuoI3Yb1R4,"Port Lavaca, TX",1
1443208436926357504,2021-09-29 13:37:59,"@unbiaseduser No vaccine works at 100% efficiency. Vaccines have a false positive and a false negative result, like all tests and procedures. The COVID vaccine has a 90%+ treatment success, which is extremely good. It works. The side effects and ""deaths"" are significantly exaggerated.","Utica, NY",0
1443189549178437633,2021-09-29 12:22:56,@simod If it wasn't for my job I wouldn't be vaccinated. I've had covid and it's literally like having a flu. I had worse side effects from this vaccine than when I had covid wallah,"Port St Lucie, FL",0
1443174950559432713,2021-09-29 11:24:55,"@cbsnewyork as far as the vaccine, it doesn’t work. You can still get COVID, you can still spread COVID, it’s not time tested so nobody knows what will happen down the road. Some of the side effects are very dangerous. The one they are giving is NOT FDA approved. Free Country?","Plainview, NY",0
1443010540729679874,2021-09-29 00:31:37,@TadSThompson Not even fair to compare wearing a hard hat to an experimental vaccine that we have no clue what the long term side effects are. You are wild 😂,"Bridge City, TX",0
1442996503711191045,2021-09-28 23:35:50,"While I’ve been vaccinated and was not concerned with potential side effects, this is one of the more thoughtful and articulate explanations for why someone might choose not to get the vaccine. https://t.co/IjlzaRxBoD","Houston, TX",0
1442996337264451589,2021-09-28 23:35:11,how long do moderna COVID vaccine side effects last?? help a b out 😣😣,"Jacksonville, TX",0
1442988023768043525,2021-09-28 23:02:08,This is the look of a very happy human who got her COVID-19 booster today 💉🦠 I’ve been waiting for this for quite some time 🤗🎉 I plead you get this vaccine &amp; booster when it’s available to you! I will share if I have any side effects—I know my family can’t wait to get theirs! https://t.co/umcGwRX6mB,"Flowood, MS",0
1442975488201269248,2021-09-28 22:12:20,"COVID-19 vaccine third shot side effects on par with second dose: @CDCgov study, which predated the recently expanded booster shot eligibility to adults over 65 and other high-risk groups. @ArlingtonVA @AlexandriaVAGov@fairfaxcounty @FallsChurchGovhttps://t.co/aPbxBvJIVC","Arlington, VA",0
1442932802194862084,2021-09-28 19:22:43,"The vaccine side effects are real, folks! https://t.co/z2MmPtozGF","Santa Clara, CA",0
1442899918390132736,2021-09-28 17:12:02,Day 1 since covid vaccine.No real side effects other than a minor sore on my left upper arm,"St Paul, MN",0
1442897096181370880,2021-09-28 17:00:50,"@NBA_NewYork @KyrieIrving @RealDealBeal23 @22wiggins @JJudahIsaac IF his scenario plays out, deadly side effects from the vaccine, that would mean Kyrie and Beal were the ones tryna save people https://t.co/FEJx85s8Wj","Bronx, NY",0
1442887493989306371,2021-09-28 16:22:40,"@LucyluSaid This isn’t a new vaccine, the composition has been used before. They didn’t just start mixing brand new shit in a pot &amp; have you seen the long term side effects of Covid? dying sucks","Ossining, NY",0
1442879556466130965,2021-09-28 15:51:08,"Y’day I got my 3rd Covid vaccine &amp; I feel great, no side effects at all. I also went to get IV fluids, while there they put me in a private room, &amp; questioned me about my bruised face &amp; the brace on my wrist. They thought that I being abused, how kind to inquire. My  pumpkins 🎃 https://t.co/ZJj35Iai41","Dallas, TX",1
1442857871377567752,2021-09-28 14:24:58,got my third shot of the vaccine on mass ave with some homeless guy. pretty strong side effects this time around.,"Boston, MA",0
1442828924334002179,2021-09-28 12:29:56,"@_tylerdixson At the beginning of the pandemic, the vaccine was intended to cure the virus. A year later and doctors and government changed their story saying you can still get the virus, but it will lessen the side effects. Wonder what they will say in the next year… 🧢","Bridge City, TX",0
1442767661293875203,2021-09-28 08:26:30,Fuck the covid vaccine. Just like the 1st dose I am experiencing really bad side effects. This shit is crazy,"Port St Lucie, FL",0
1442767279762993152,2021-09-28 08:24:59,@Wetworxx Almost guaranteed that driver is all about the common good or whatever. Sorry not sorry not taking a vaccine for a virus with a 98% survival rate. People like to talk about polio and smallpox. One lower survival rate and first couple batches had horrible  side effects,"Evans, CO",0
1442726641508048896,2021-09-28 05:43:30,@CallMeMelLV I get it every year and no side effects like the COVID vaccine has.,"Henderson, NV",0
1442708551911227392,2021-09-28 04:31:37,"@F77110076 @Baxter Burner accounts are more laughable. I never got the vaccine thinking it would stop covid, rather minimize catastrophic side effects and SLOW the spread. But some can’t grasp that.","Edmond, OK",0
1442669249529585669,2021-09-28 01:55:27,"@livinginthenow I got the Moderna vaccine (2nd in April). Happy with it,  no side effects. I've heard that the FDA/CDC will be considering a booster for both, Moderna and J&amp;J within the next two weeks. They recommend waiting and not jumping the gun or mixing vaccines.Best of luck.","Nicholasville, KY",0
1442668217462398977,2021-09-28 01:51:21,Because the vaccine is an antibody shot designed to protect you and others from serious side effects. Not designed to prevent Covid https://t.co/qUGOw9lKkK,"Houston, TX",0
1442666468588539904,2021-09-28 01:44:24,#RHOP and @KARENHUGER had me literally laughing out loud with her “side effects” from the vaccine. Those slow motion scenes had me in the floor. I needed that laugh today. #Bravo #Vassinated,"Helena, AL",0
1442648216198070272,2021-09-28 00:31:52,@FreedomsBetter The hospitals are not filling up with people suffering from vaccine side effects. Oh and if you test positive for Covid they won’t vaccinate until you recover.  More dumb shit from the Anti Vax crowd.,"Port Jervis, NY",0
1442644319274475529,2021-09-28 00:16:23,@DamuJR @LegendDurham @BrotherFurious A bulletproof you can take off and there aren’t any side effects at all. The vaccine has killed people. I don’t think that’s a good analogy.,"Coconut Creek, FL",0
1442641314919686147,2021-09-28 00:04:27,"@stephenasmith https://t.co/0UfF6k3ydi Beal &amp; others waiting for more research &amp; evidence on the vaccine….maybe we could run a trial with 3.5 billion people…oh wait, we just did that. Vaccines cannot give U COVID-19. U may have side effects after vaccination. These r normal &amp; last a few days.","Massachusetts, USA",0
1442638931422588928,2021-09-27 23:54:58,@MiaFarrow I received my booster vaccine three days ago and had no side effects ! Everyone please get vaccinated ! Thank you for sharing @MiaFarrow,"Indianapolis, IN",0
1442618129671151619,2021-09-27 22:32:19,"@JarethOMMB I’m not accusing you of saying you hate him, and you’re absolutely entitled to your opinion. Today he basically said he believes he has natural immunity and is not necessarily scared of getting COVID again and that there is a small chance of side effects with the vaccine.","New Port Richey, FL",0
1442597221124411403,2021-09-27 21:09:14,"Man this crazy, you can’t force a vaccine on people, vaccines have a history of having long term side effects https://t.co/mnGYSLn971","Huntsville, AL",0
1442592738243854336,2021-09-27 20:51:25,@kevin_hairless @ChiefinWahoo @TheKitastrophe @brohrbach It’s a federal crime to knowingly file a false claim about vaccine side effects and they make that pretty obvious before trying to fill out a VAERS form. I’d expect that’s a pretty big deterrent to people lying on a VAERS form so it makes sense to assume claims are mostly true.,"Red Hook, NY",0
1442586728687194115,2021-09-27 20:27:32,THE VACCINES ARE KILLING THE PEOPLE AND THEY CALL IT COVID THERE ARE OVER 25 DIFFERENT SIDE EFFECTS AND THE NEWS MEDIA IS HIDING THE TRUTH AND SO ARE THE DEMOCRATS!! THEY ARE BLAMING THE SMART PEOPLE THAT WILL NOT BE KILLED BUY A VACCINE!! IT'S A CHOICE AND I WANT TO LIVE!! https://t.co/G6pwEor9Vx,"Florida, USA",0
1442585769907003399,2021-09-27 20:23:44,"@Isabella_art6 For me it was no different than getting my flu shot. I got the Moderna vaccine so I had to get 2 shots. Had no side effects from it. People respond differently. You may have a sore arm, headache, or legs feel heavy, but you'll survive. Don't be afraid. Go get your shot. ❤","Indiana, USA",0
1442565458528505858,2021-09-27 19:03:01,"@Isabella_art5 My husband, 12 y/o, &amp; me both had arm soreness the next day. I only know one person who had real side effects from the vaccine, my MIL ran a fever the day after her second dose. She was totally recovered the day after that tho.","Wisconsin, USA",0
1442533979496886272,2021-09-27 16:57:56,@jack_msw @houseofbones @jennylynnpalmer @JoyAnnReid I'm not edgy... the fear of Covid based on survivability is illogical and the cult like fervor over an experimental vaccine which isn't a vaccine and has been found to have terrible side effects is asinine,"Missouri, USA",0
1442529614861987847,2021-09-27 16:40:35,Long overdue but finally getting the Pfizer vaccine. Let's hope the side effects doesn't whoop my butt,"St Paul, MN",0
1442502147736756225,2021-09-27 14:51:27,"The vaccine protected us both, her viral load was lesser and I never was infected. Vaccines work! With that said, she is struggling with side effects that we have no way of knowing how long they will last. 2/3","New York, USA",0
